{
  "schema_version": "uaa-founder-loop-api-perimeter.v1",
  "status": "implemented_contract_and_verifier_no_runtime_authority",
  "milestone_ref": "FCC-V1-001",
  "api_manifest_ref": "/api/manifest",
  "openapi_contract_ref": "docs/api/openapi_contract.md",
  "route_inventory_ref": "tests/fixtures/api_route_inventory_133.json",
  "release_surface_manifest_ref": "docs/control_center/release_surface_manifest.json",
  "runtime_authority_added": false,
  "routes_added": false,
  "durable_replay_runtime_added": false,
  "public_beta_claim_enabled": false,
  "production_readiness_claim_enabled": false,
  "manual_review_completion_claimed": false,
  "manual_review_status": "deferred_until_later_local_review",
  "rate_limits_are_auth": false,
  "required_route_posture_fields": [
    "route_classification",
    "side_effect_class",
    "auth_posture",
    "approval_posture",
    "idempotency_posture",
    "rate_limit_posture"
  ],
  "duplicate_replay_contract": {
    "current_runtime_status": "blocked_until_route_owner_append_first_receipts",
    "same_key_same_payload": "required_future_return_prior_receipt",
    "same_key_conflicting_payload": "required_future_reject_conflict",
    "evidence_requirement_ref": "receipt-backed append-first route-owner storage"
  },
  "current_mutating_route_count": 137,
  "current_mutating_routes": [
    {
      "method": "POST",
      "path": "/api/runtime/authority-leases",
      "operation_id": "post_api_runtime_authority_leases",
      "side_effect_class": "local_dev_workspace_only",
      "route_classification": "mutating_requires_authority",
      "auth_posture": "protected_local_bearer_required",
      "approval_posture": "required_before_mutation_authority",
      "idempotency_posture": "required_before_mutation_authority",
      "idempotency_policy_ref": "idempotency:p1-084:mutating-routes:v1",
      "rate_limit_posture": "targeted_local_fixed_window",
      "rate_limit_group": "governed_runtime_pilot"
    },
    {
      "method": "POST",
      "path": "/api/runtime/authority-leases/approve-and-issue",
      "operation_id": "post_api_runtime_authority_leases_approve_and_issue",
      "side_effect_class": "local_dev_workspace_only",
      "route_classification": "mutating_requires_authority",
      "auth_posture": "protected_local_bearer_required",
      "approval_posture": "required_before_mutation_authority",
      "idempotency_posture": "required_before_mutation_authority",
      "idempotency_policy_ref": "idempotency:p1-084:mutating-routes:v1",
      "rate_limit_posture": "targeted_local_fixed_window",
      "rate_limit_group": "governed_runtime_pilot"
    },
    {
      "method": "POST",
      "path": "/api/runtime/authority-leases/revoke",
      "operation_id": "post_api_runtime_authority_leases_revoke",
      "side_effect_class": "local_dev_workspace_only",
      "route_classification": "mutating_requires_authority",
      "auth_posture": "protected_local_bearer_required",
      "approval_posture": "required_before_mutation_authority",
      "idempotency_posture": "required_before_mutation_authority",
      "idempotency_policy_ref": "idempotency:p1-084:mutating-routes:v1",
      "rate_limit_posture": "targeted_local_fixed_window",
      "rate_limit_group": "governed_runtime_pilot"
    },
    {
      "method": "POST",
      "path": "/api/runtime/authority-missions/approval-decisions",
      "operation_id": "post_api_runtime_authority_mission_approval_decision",
      "side_effect_class": "local_dev_workspace_only",
      "route_classification": "mutating_requires_authority",
      "auth_posture": "protected_local_bearer_required",
      "approval_posture": "required_before_mutation_authority",
      "idempotency_posture": "required_before_mutation_authority",
      "idempotency_policy_ref": "idempotency:p1-084:mutating-routes:v1",
      "rate_limit_posture": "targeted_local_fixed_window",
      "rate_limit_group": "governed_runtime_pilot"
    },
    {
      "method": "POST",
      "path": "/api/runtime/authority-missions/cancel",
      "operation_id": "post_api_runtime_authority_mission_cancel",
      "side_effect_class": "local_dev_workspace_only",
      "route_classification": "mutating_requires_authority",
      "auth_posture": "protected_local_bearer_required",
      "approval_posture": "required_before_mutation_authority",
      "idempotency_posture": "required_before_mutation_authority",
      "idempotency_policy_ref": "idempotency:p1-084:mutating-routes:v1",
      "rate_limit_posture": "targeted_local_fixed_window",
      "rate_limit_group": "governed_runtime_pilot"
    },
    {
      "method": "POST",
      "path": "/api/runtime/authority-missions/dead-letter-recovery",
      "operation_id": "post_api_runtime_authority_mission_dead_letter_recovery",
      "side_effect_class": "local_dev_workspace_only",
      "route_classification": "mutating_requires_authority",
      "auth_posture": "protected_local_bearer_required",
      "approval_posture": "required_before_mutation_authority",
      "idempotency_posture": "required_before_mutation_authority",
      "idempotency_policy_ref": "idempotency:p1-084:mutating-routes:v1",
      "rate_limit_posture": "targeted_local_fixed_window",
      "rate_limit_group": "governed_runtime_pilot"
    },
    {
      "method": "POST",
      "path": "/api/runtime/command/run",
      "operation_id": "post_api_runtime_command_run",
      "side_effect_class": "local_dev_workspace_only",
      "route_classification": "mutating_requires_authority",
      "auth_posture": "protected_local_bearer_required",
      "approval_posture": "required_before_mutation_authority",
      "idempotency_posture": "required_before_mutation_authority",
      "idempotency_policy_ref": "idempotency:p1-084:mutating-routes:v1",
      "rate_limit_posture": "targeted_local_fixed_window",
      "rate_limit_group": "governed_runtime_pilot"
    },
    {
      "method": "POST",
      "path": "/api/runtime/goals",
      "operation_id": "post_api_runtime_goals",
      "side_effect_class": "local_dev_workspace_only",
      "route_classification": "mutating_requires_authority",
      "auth_posture": "protected_local_bearer_required",
      "approval_posture": "required_before_mutation_authority",
      "idempotency_posture": "required_before_mutation_authority",
      "idempotency_policy_ref": "idempotency:p1-084:mutating-routes:v1",
      "rate_limit_posture": "targeted_local_fixed_window",
      "rate_limit_group": "governed_runtime_pilot"
    },
    {
      "method": "POST",
      "path": "/api/runtime/goals/approval-requests/create",
      "operation_id": "post_api_runtime_goals_approval_requests_create",
      "side_effect_class": "local_dev_workspace_only",
      "route_classification": "mutating_requires_authority",
      "auth_posture": "protected_local_bearer_required",
      "approval_posture": "required_before_mutation_authority",
      "idempotency_posture": "required_before_mutation_authority",
      "idempotency_policy_ref": "idempotency:p1-084:mutating-routes:v1",
      "rate_limit_posture": "targeted_local_fixed_window",
      "rate_limit_group": "governed_runtime_pilot"
    },
    {
      "method": "POST",
      "path": "/api/runtime/goals/approval-requests/revoke",
      "operation_id": "post_api_runtime_goals_approval_requests_revoke",
      "side_effect_class": "local_dev_workspace_only",
      "route_classification": "mutating_requires_authority",
      "auth_posture": "protected_local_bearer_required",
      "approval_posture": "required_before_mutation_authority",
      "idempotency_posture": "required_before_mutation_authority",
      "idempotency_policy_ref": "idempotency:p1-084:mutating-routes:v1",
      "rate_limit_posture": "targeted_local_fixed_window",
      "rate_limit_group": "governed_runtime_pilot"
    },
    {
      "method": "POST",
      "path": "/api/runtime/goals/approval-requests/{approval_request_ref}/decision",
      "operation_id": "post_api_runtime_goals_approval_requests_approval_request_ref_decision",
      "side_effect_class": "local_dev_workspace_only",
      "route_classification": "mutating_requires_authority",
      "auth_posture": "protected_local_bearer_required",
      "approval_posture": "required_before_mutation_authority",
      "idempotency_posture": "required_before_mutation_authority",
      "idempotency_policy_ref": "idempotency:p1-084:mutating-routes:v1",
      "rate_limit_posture": "targeted_local_fixed_window",
      "rate_limit_group": "governed_runtime_pilot"
    },
    {
      "method": "POST",
      "path": "/api/runtime/goals/{goal_ref}/approval-requests/edit",
      "operation_id": "post_api_runtime_goals_goal_ref_approval_requests_edit",
      "side_effect_class": "local_dev_workspace_only",
      "route_classification": "mutating_requires_authority",
      "auth_posture": "protected_local_bearer_required",
      "approval_posture": "required_before_mutation_authority",
      "idempotency_posture": "required_before_mutation_authority",
      "idempotency_policy_ref": "idempotency:p1-084:mutating-routes:v1",
      "rate_limit_posture": "targeted_local_fixed_window",
      "rate_limit_group": "governed_runtime_pilot"
    },
    {
      "method": "POST",
      "path": "/api/runtime/goals/{goal_ref}/approval-requests/transition",
      "operation_id": "post_api_runtime_goals_goal_ref_approval_requests_transition",
      "side_effect_class": "local_dev_workspace_only",
      "route_classification": "mutating_requires_authority",
      "auth_posture": "protected_local_bearer_required",
      "approval_posture": "required_before_mutation_authority",
      "idempotency_posture": "required_before_mutation_authority",
      "idempotency_policy_ref": "idempotency:p1-084:mutating-routes:v1",
      "rate_limit_posture": "targeted_local_fixed_window",
      "rate_limit_group": "governed_runtime_pilot"
    },
    {
      "method": "POST",
      "path": "/api/runtime/goals/{goal_ref}/edit",